マルハン明石店,兵庫県明石市大久保町西脇字大池の内526-1,1パチ:202台2パチ:120台5スロ:160台,,320,160,293
ミリオン明石店,兵庫県明石市大久保町大窪字柳池1番地,4パチ:480台1パチ:160台20スロ:320台5スロ:80台,,640,400,1000
ミクちゃんガイア西明石店,兵庫県明石市松の内2-3-9,4パチ:56台1.25パチ:144台5スロ:40台,,200,40,-
Dio　Premio土山店,兵庫県明石市魚住町清水2147-1,0.25パチ:64台1.25パチ:48台2.5パチ:16台2.5スロ:39台5スロ:53台10スロ:28台,,128,120,140
ラッキー1番 明石店,兵庫県明石市大久保町西島字天神759番地の1,4パチ:194台1パチ:145台20スロ:80台2スロ:39台,456,,,420
る・それいゆ大久保店,兵庫県明石市大久保町駅前1-17-12,パチンコ：[4][1]パチスロ：[20],,176,65,-
モナコ西明石,兵庫県明石市松の内2-5-3,4パチ:168台1パチ:105台20スロ:120台,,273,120,-
アクア,兵庫県明石市魚住町中尾539,,200,,,120
ガイアシティー西明石店,兵庫県明石市松の内2-4-5　外3筆,,,,,-
AISEN,兵庫県明石市二見町東二見387-4,20スロ:-台,,303,92,280
ベニス明石店,兵庫県明石市大明石町1-6-22,,,,,-
パチンコメトロ明石店,兵庫県明石市本町1-2-32,,,,,-
サンケイホール,兵庫県明石市大久保町駅前1-10-10,,,,,-
銀の葡萄明石店,兵庫県明石市東仲ノ町6-1ＡＳＰＩＡ明石北館,,,,,-
銀の葡萄セカンド明石店,兵庫県明石市東仲ノ町10-15,,,,,-
アルカディア,兵庫県明石市二見町西二見字西上岡2080番地の1,,,,,-
ミクちゃんガイア西宮店,兵庫県西宮市山口町下山口2-2-38,1000円/188枚スロ:41台21.277スロ:229台,,0,270,200
MIWA GARDEN,兵庫県西宮市田中町2-2,[4][1][0.4]パチ,,193,0,56(近隣キングコング)、無料提携駐車
チャンピオン西宮店,兵庫県西宮市高松町4-3,4パチ:209台1パチ:210台20スロ:156台2スロ:39台,,420,195,615
ナルパチDino,兵庫県西宮市鳴尾町1-1-21,4パチ:100台1パチ:50台2パチ:50台20スロ:80台,,200,80,-
キコーナ阪神西宮店,兵庫県西宮市今在家町1-18,4パチ:137台1パチ:161台20スロ:92台2スロ:42台,,297,138,76(ハイルーフ車は駐車不可です)
スロットキコーナ今津店,兵庫県西宮市津門川町13-11,20スロ:285台2スロ:48台,,0,333,店舗横駐車場、キコーナタウン駐車場をご利用下さい
ニューメトロ甲子園口店,兵庫県西宮市甲子園口3-14-15,4パチ:52台1パチ:76台1000円/116枚スロ:13台21.277スロ:87台,127,,,45
Dino甲子園口,兵庫県西宮市甲子園口2-15-35,4パチ:32台1パチ:51台2パチ:54台20スロ:33台5スロ:16台,,137,49,有
キングコング,兵庫県西宮市馬場町1-25,20スロ:222台2.5スロ:41台5スロ:20台10スロ:24台,,0,307,56(無料提携駐車場「エビスタ」もあり
キコーナ甲子園口店,兵庫県西宮市甲子園口北町2-3,4パチ:110台1パチ:65台20スロ:73台,,180,72,38
キコーナル今津店,兵庫県西宮市津門呉羽町1-33,4パチ:45台2パチ:43台5スロ:83台,,88,84,140
キコーナタウン今津店,兵庫県西宮市津門呉羽町2-35,4パチ:258台1パチ:-台20スロ:218台,,432,218,140
シャトル,兵庫県西宮市常磐町1-39,,,176,140,20
BLESS,兵庫県西宮市津門宝津町10-7,20スロ:106台2スロ:27台5スロ:79台,,0,212,-
キコーナ今津駅前店,兵庫県西宮市今津水波町2-2,1パチ:139台20スロ:129台,,138,133,21
パーラートップワン,兵庫県西宮市今津水波町2-26,4パチ:331台1.25パチ:172台20スロ:154台5スロ:41台,,523,195,330
ファンタジー,兵庫県西宮市今在家町3-22,,,,,-
EBISU　CITY,兵庫県西宮市田中町5-5,,,,,-
ビーカム西宮店,兵庫県西宮市津門大箇町3-5,,,,,-
パチンコジャンボ,兵庫県西宮市中前田町6-2,,,,,-
HANAKO,兵庫県西宮市今在家町1-10,,,,,-
プレイランドパートⅡ,兵庫県西宮市今在家町3-15,,,,,-
花電車,兵庫県西宮市今在家町1-15,,,,,-
The Ｃlassic,兵庫県洲本市本町4-3-23,,,,,-
洲本ミリオン,兵庫県洲本市塩屋1-1-57,,,,,-
フェスタエミリア,兵庫県洲本市本町5-1-32,,,,,-
ホワイトハウス洲本店,兵庫県洲本市物部1-8-3,,,,,-
スロットクラブバニラ,兵庫県伊丹市中央1-4-23,20スロ:84台5スロ:28台,,0,112,-
パチンコキコーナ伊丹店,兵庫県伊丹市中央1-6-8,"[4][1]パチ[1,000円＝47枚]スロ",,315,0,-
スロットキコーナ伊丹店,兵庫県伊丹市中央1-8-14,1000円/47枚スロ:304台,,0,304,-
タウンライト伊丹,兵庫県伊丹市中央4-1-21,4パチ:74台0.2パチ:54台1パチ:81台1000円/470枚スロ:33台1000円/47枚スロ:60台,,224,93,-
ゼニスコート阪急伊丹店,兵庫県伊丹市西台1-1-1,4パチ:344台1パチ:108台20スロ:96台,4,,,-グループ店伊丹一番駐車場・中央モータープールは終日無料。伊丹駅リータ駐車場は2時間無料。
ゼニスコートグランスロット,兵庫県伊丹市西台1-4-5,4スロ:57台21.277スロ:359台,416,,,提携駐車場有!詳しくはお近くのキャストまで。
キコーナ伊丹店,兵庫県伊丹市中央1-9-18,1パチ:194台4スロ:36台8スロ:103台,,198,140,阪急伊丹駅前タイムズ
伊丹一番,兵庫県伊丹市中央2-9-8,,,272,140,約140
ソニックビート,兵庫県伊丹市中央4-1-8,,,266,0,-
モナコ相生,兵庫県相生市那波野316,4パチ:240台1パチ:160台1000円/188枚スロ:30台1000円/47枚スロ:150台,,400,180,500
ミクちゃんアリーナ豊岡店,兵庫県豊岡市梶原355-1,,,0,270,200
ワールドカップ豊岡店,兵庫県豊岡市土渕1206,4パチ:-台0.5パチ:-台1パチ:-台2パチ:-台20スロ:-台5スロ:-台10スロ:-台,518,,,500
パチンコ&スロット トマト,兵庫県豊岡市中陰621-1,,,247,240,250
ぱちんこ村,兵庫県豊岡市寿町4-8,4パチ:120台0.5パチ:39台1パチ:120台1000円/200枚スロ:20台1000円/50枚スロ:100台,,280,120,230
ミクちゃんガイア豊岡店,兵庫県豊岡市梶原368-1,,,196,52,180
UFO豊岡,兵庫県豊岡市上佐野1417,4パチ:280台1パチ:120台20スロ:206台5スロ:38台,,400,245,-
キコーナタウン豊岡店,兵庫県豊岡市昭和町6-10,パチンコ：[4][1]パチスロ：[20][2],,320,240,400
ダイナム兵庫豊岡店　ゆったり館,兵庫県豊岡市日撫字ナンゴ286番地2,1パチ:240台2パチ:80台1000円/89枚スロ:80台,,320,80,有
モナコ加古川,兵庫県加古川市野口町坂元69-1,4パチ:176台1パチ:132台21.277スロ:128台,,308,128,320
ビッグアップル.加古川,兵庫県加古川市野口町坂井18,4パチ:320台0.5パチ:80台1パチ:280台20スロ:420台5スロ:138台,,680,558,860
モナコ別府,兵庫県加古川市別府町朝日町9,,,0,208,200
マルハン加古川店,兵庫県加古川市尾上町安田366,パチンコ：[4][1]パチスロ：[20],,400,320,588
キコーナ加古川店,兵庫県加古川市野口町坂元45-1,パチンコ：[4][1]パチスロ：[20],,728,555,800
ミクちゃんガイア東加古川店,兵庫県加古川市平岡町新在家716-10-3,[4][1][0.2]パチ[20][2.5]スロ4パチ:94台1パチ:126台0.2パチ:32台20スロ:96台2.5スロ:32台,,252,128,200
パーラー虎王,兵庫県加古川市神野町石守364,,,264,113,314
る・それいゆ　東加古川店,兵庫県加古川市平岡町新在家2-279-4,100円/25玉パチ:134台1000円/50枚スロ:82台,,134,82,17(外部に提携駐車場有り)
モナコリゾート,兵庫県加古川市尾上町長田11-1,4パチ:166台1パチ:99台20スロ:149台5スロ:88台,,261,239,500
ニューラスベガス,兵庫県加古川市野口町北野1098,,4,,,300
る・それいゆ　別府店,兵庫県加古川市別府町緑町3,パチンコ：[4][1]パチスロ：1000円47枚貸し,4,,,200
ミクちゃんガイアアリーナ店,兵庫県加古川市東神吉町西井ノ口301-2,4パチ:478台1パチ:215台1000円/188枚スロ:64台21.277スロ:448台,1214,,,907
ミクちゃんガイア加古川ジョイパーク店,兵庫県加古川市尾上町今福71-2,4パチ:335台1パチ:205台1000円/188枚スロ:69台21.277スロ:424台,1039,,,1000
ラスベガス上荘店,兵庫県加古川市上荘町都染693-1,4パチ:128台1パチ:96台20スロ:92台5スロ:30台,4,,,252
ミクちゃんガイア21平岡店,兵庫県加古川市平岡町一色592-4,4パチ:158台1パチ:120台20スロ:-台5スロ:-台1000円/188枚スロ:40台21.277スロ:160台,,280,200,344
夢屋加古川店,兵庫県加古川市尾上町池田字池田開拓1917サザンプラザ内,4パチ:-台0.5パチ:-台1パチ:-台20スロ:-台5スロ:-台,,580,400,723
コロンビア,兵庫県加古川市尾上町安田232-1,,,184,138,290
トップワン加古川店,兵庫県加古川市尾上町安田534-1,4パチ:231台0.4パチ:152台1.25パチ:380台20スロ:155台2.5スロ:76台5スロ:76台,,763,307,905
KOSMOS,兵庫県加古川市別府町新野辺北町7-11,,,252,105,216
パーラーメッセ加古川,兵庫県加古川市平岡町新在家716-16,,,249,158,たくさん♪立体駐車場あり
ルネッサンス,兵庫県加古川市別府町西脇180,20スロ:-台,,200,120,380
メガガイア土山店,兵庫県加古川市平岡町土山850-4,,,,,-
加古川太陽,兵庫県加古川市加古川町篠原町1-25-1,,,130,58,-
マルハン赤穂店,兵庫県赤穂市中広2番地8,4パチ:195台1パチ:120台1000円/188枚スロ:40台21.277スロ:196台,,320,240,327
スーパー虎王,兵庫県赤穂市中広字島田149-1,4パチ:200台1パチ:120台20スロ:180台1スロ:36台,,320,180,500
アビック赤穂店,兵庫県赤穂市細野町553,1000円/376枚スロ:26台1000円/188枚スロ:64台21.277スロ:230台,320,,,337
虎王Jr.,兵庫県赤穂市細野町50,100円/25玉パチ:30台,,180,167,250
マルハン西脇店,兵庫県西脇市上野125-3,4パチ:201台1パチ:80台,,280,200,334
ミクちゃんアリーナ西脇店,兵庫県西脇市和田町784-1,４円ぱちんこ・２００台１円ぱちんこ・１２０台２０円スロット・３２０台,640,,,598
ＴＥＮＩＣＨＩ西脇店,兵庫県西脇市西田町207-1,,,192,128,222
アクセス西脇店,兵庫県西脇市和布町170-8,,,288,96,276
ミクちゃんアリーナ宝塚店,兵庫県宝塚市栄町2-11-24,1000円/188枚スロ:50台21.277スロ:168台,,0,218,約200
ミクちゃんガイア宝塚店,兵庫県宝塚市栄町2-12-11,4パチ:140台1パチ:144台,,4,0,約200
ベラジオ逆瀬川店,兵庫県宝塚市逆瀬川1-2-1アピア１・１Ｆ,4パチ:48台0.5パチ:26台1パチ:53台20スロ:28台2.5スロ:22台8スロ:25台,,127,75,提携駐車場駐輪場完備アピア1・2の駐車場をご利用下さい。
スーパーラッキー800,兵庫県宝塚市高司4-6-31,4パチ:360台1パチ:144台20スロ:252台5スロ:36台,,504,288,700
キコーナ宝塚,兵庫県宝塚市栄町2-1-1ソリオ内,4パチ:146台0.2パチ:-台1パチ:-台21.277スロ:-台,,271,119,提携駐車場アリ600
トップワン宝塚店,兵庫県宝塚市安倉西4-15-12,4パチ:434台1.25パチ:108台20スロ:208台5スロ:26台,,566,0,500
ラッキー1番　宝塚店,兵庫県宝塚市小浜3丁目14番23号,,,156,52,130
モナコ宝塚,兵庫県宝塚市美幸町10-66,,,756,448,1000
ロトプレーヤー三木店,兵庫県三木市別所町小林字土居際476-4,4パチ:96台1パチ:80台1000円/200枚スロ:30台1000円/50枚スロ:128台,,0,160,300
ミクちゃんガイア三木南店,兵庫県三木市福井2148-2,4パチ:284台1パチ:156台1000円/188枚スロ:78台21.277スロ:190台,,452,268,532
ミクちゃんガイア三木店,兵庫県三木市平田4−1,4パチ:62台1.25パチ:134台1000円/188枚スロ:17台1000円/47枚スロ:85台,,198,102,246
パチンコ　オトム２,兵庫県三木市加佐260-12,0.25パチ:40台1パチ:106台2.778スロ:40台1000円/90枚スロ:110台,,154,156,280
123三木店,兵庫県三木市別所町小林657-20,4パチ:212台1パチ:216台1000円/188枚スロ:34台21.277スロ:245台,,432,288,556
モナコ三木,兵庫県三木市志染町広野5-147,4パチ:239台1パチ:160台1000円/188枚スロ:37台1000円/47枚スロ:176台,,400,216,500
パチンコ オトム1,兵庫県三木市大村588-1,,,223,212,600
トップワン三木店,兵庫県三木市福井3-5-15,0.4パチ:24台1.25パチ:135台2.5スロ:24台5スロ:134台,,159,158,220
丸三高砂店,兵庫県高砂市梅井5-5-25,4パチ:-台1.25パチ:-台2.5パチ:-台20スロ:-台6.25スロ:-台,,180,108,いっぱい★
EARTH21高砂店,兵庫県高砂市中島3-5-12,4パチ:200台1パチ:120台20スロ:120台,,320,120,270
ベガスロット,兵庫県高砂市中筋1-10-26,1パチ:-台20スロ:72台5スロ:50台,198,,,120
タイガー高砂,兵庫県高砂市阿弥陀町魚橋482-1,,,250,148,300
パチンコ F-1高砂店,兵庫県高砂市伊保町中筋589,,,,,-
スロットF-1,兵庫県高砂市神爪1-5-16,,,,,-
ニュースター,兵庫県高砂市伊保2-5-25,,,,,-
キコーナタウン川西多田院店,兵庫県川西市多田院西1-9-3,パチンコ[4]240台[1]120台[0.2]40台スロット[20]200台[4]40台,,400,240,560
ソニックバレー1,兵庫県川西市見野2-7-8,4パチ:233台0.5パチ:39台1パチ:160台20スロ:100台5スロ:18台,,440,118,420
ビーカム川西店,兵庫県川西市久代2-4-13,,,324,180,400
キコーナキセラ川西店,兵庫県川西市火打1-19-1,4パチ:235台0.2パチ:80台1パチ:160台1000円/470枚スロ:40台1000円/47枚スロ:360台,,480,400,550
Taiyo川西店,兵庫県川西市栄町25-1アステ川西１Ｆ,4パチ:224台1パチ:76台20スロ:123台,,300,123,-
でるでる川西,兵庫県川西市加茂6-125-1,[4][1]パチ[20]スロ,,880,428,905
キコーナ川西加茂店,兵庫県川西市加茂1-20-2,4パチ:142台1パチ:103台20スロ:108台,,247,108,240
パチンコ デルジャン･スロット クイーン D,兵庫県川西市中央町4-7,4パチ:131台1パチ:123台2パチ:18台20スロ:130台2スロ:38台5スロ:33台,,278,206,600
Hひまわり川西店,兵庫県川西市久代5-1-8,4パチ:-台1パチ:-台20スロ:-台5スロ:-台,,188,140,-
123川西店,兵庫県川西市多田院西2-3-8,4パチ:252台1パチ:252台1000円/188枚スロ:76台21.277スロ:214台,,504,293,600
メトロセンター川西店,兵庫県川西市多田桜木2-10-27,,,252,108,200
エムイーロッソ,兵庫県川西市西多田楠根4-6,,,,,-
5カラット小野店,兵庫県小野市敷地町1382-26,1000円/188枚スロ:85台1000円/47枚スロ:230台,315,,,251
スイス会館,兵庫県小野市樫山町1488-1,,,72,72,-
キコーナ小野店,兵庫県小野市浄谷町34-1,パチンコ：[4][1.25]パチスロ：[20][8],,156,96,150
トップワン小野店,兵庫県小野市敷地町1639-1,4パチ:130台0.5パチ:35台1.25パチ:107台20スロ:216台5スロ:72台,,288,288,345
タイガー小野,兵庫県小野市王子町659-1,,,224,112,300
イルサローネ三田店,兵庫県三田市三輪4-5-32,4パチ:164台1パチ:124台21.277スロ:200台,,292,200,600
パーラーエンデバー,兵庫県三田市武庫が丘7-2-1,4パチ:40台0.5パチ:35台1パチ:110台2パチ:35台21.277スロ:-台,,0,93,-
123新三田店,兵庫県三田市福島字宮野前501-90,4パチ:312台1パチ:160台1000円/47枚スロ:316台,,480,320,-
ＳＬＯＴ　ＰＡＲＫ　ＢＩＧＢＡＮＧ,兵庫県三田市上井沢133,,,0,128,160
パーラー三田城,兵庫県三田市駅前町20-20,5スロ:-台,,240,160,300
タイガー加西,兵庫県加西市北条町北条127,,,264,137,300
GR,兵庫県篠山市吹新20-2,4パチ:132台1パチ:44台1000円/200枚スロ:21台1000円/50枚スロ:83台,280,,,233
ダイナム兵庫篠山店,兵庫県丹波篠山市宇土字一丁突田ノ坪406番地,4パチ:240台100円/89玉パチ:80台20スロ:160台,,320,160,480
えんた～ていめんと篠山でるで,兵庫県篠山市風深字荒句ノ坪225,,,,,-
キコーナ八鹿店,兵庫県養父市八鹿町八鹿1535-1,,,216,144,344
マルハン氷上店,兵庫県丹波市氷上町横田字きろめき500,4パチ:200台1パチ:80台20スロ:120台,,280,120,320
ドリーム・ワン,兵庫県丹波市氷上町常楽1087-1,,,,,-
パチンコ春日,兵庫県丹波市春日町黒井1403-1,,,,,-
バルバロ,兵庫県丹波市柏原町柏原2622-6,,,,,-
パチンコ F-1丹波店,兵庫県丹波市氷上町稲継味亀62-1,,,,,-
パチンコミリオン,兵庫県南あわじ市八木養宜上1029-6,,,,,-
南淡ホワイトハウス,兵庫県南あわじ市賀集441番地,,,,,-
ダイナム兵庫和田山店,兵庫県朝来市和田山町枚田字大川除583番地2,4パチ:240台100円/89玉パチ:80台21.277スロ:160台,,320,160,487
キコーナ和田山店,兵庫県朝来市和田山町枚田字池寺792-2,パチンコ：[4][1]パチスロ：[20][4],,216,144,320
ＴＥＮＩＣＨＩ和田山店,兵庫県朝来市和田山町土田448-5,,,279,108,-
パチンコ津名ホワイトハウス,兵庫県淡路市竹谷字忠谷6の1,,,,,-
C－RIZE東浦店,兵庫県淡路市久留麻字下坪156,,,,,-
C－RIZE北淡店,兵庫県淡路市育波403,,,,,-
バルセロナ,兵庫県淡路市志筑116-2,,,,,-
C－RIZE,兵庫県淡路市大谷863-1,,,,,-
5カラット山崎店,兵庫県宍粟市山崎町御名341,4パチ:132台0.25パチ:21台1.25パチ:132台1000円/188枚スロ:44台1000円/47枚スロ:126台,,285,170,-
ＴＡＲＺＡＮ山崎店,兵庫県宍粟市山崎町千本屋180-1,[4]パチ８８台[１]パチ５６台[20]スロ６６台,,144,66,-
ラッツ山崎店,兵庫県宍粟市山崎町中井112-1,4パチ:120台1パチ:80台20スロ:96台,,200,96,250
パーラーイチカン,兵庫県宍粟市一宮町安積1326,,,,,-
俺のパチンコ,兵庫県宍粟市一宮町安積267-7,,,,,-
社スイス,兵庫県加東市上中3-130,,,250,128,336
パチンコトウリュウ,兵庫県加東市北野467,,,91,141,150
アイゼンたつの店,兵庫県たつの市揖保川町新在家207-7,4パチ:150台1.25パチ:90台21.277スロ:180台,,240,180,315
ラッツたつの店,兵庫県たつの市神岡町東觜崎字六反田598-1,20スロ:238台,238,,,200
ダイナム兵庫たつの店　ゆったり館,兵庫県たつの市誉田町広山41番地1,100円/89玉パチ:280台200円/89玉パチ:40台500円/89枚スロ:30台1000円/89枚スロ:160台,,320,190,360
ランドマークたつの,兵庫県たつの市新宮町仙正71-3,20スロ:198台,200,,,220
サンミラクル,兵庫県たつの市龍野町堂本38-10,0.5パチ:40台1パチ:72台100円/25玉パチ:24台1000円/200枚スロ:40台1000円/50枚スロ:64台1000円/47枚スロ:-台,,136,109,-
P＆S　LOVE,兵庫県たつの市神岡町奥村字畑ケ田25,4パチ:-台1パチ:-台1000円/188枚スロ:-台21.277スロ:-台,,156,145,300
トップワンたつの店,兵庫県たつの市誉田町広山77−2,4パチ:101台0.4パチ:50台1.25パチ:153台20スロ:156台5スロ:160台,,312,316,455
モナコ龍野,兵庫県たつの市誉田町広山字金剛寺30-7,,,456,192,660
パーラーV．O．X,兵庫県川辺郡猪名川町紫合字遠辺505-6,,,,,-
アポロ,兵庫県多可郡多可町中区茂利262,,,,,-
パーラー花･花,兵庫県加古郡稲美町中村1222,,,199,164,450
キコーナ福崎店,兵庫県神崎郡福崎町南田原字大塚2996-1,4パチ:-台1パチ:-台20スロ:-台2スロ:-台,,240,160,300
タイガー福崎,兵庫県神崎郡福崎町南田原3021,,,256,116,350
パーラー5カラット太子店,兵庫県揖保郡太子町矢田部字大谷口464,4パチ:156台1.25パチ:177台1000円/188枚スロ:26台1000円/47枚スロ:264台,,333,290,400
ＴＡＲＺＡＮ太子店,兵庫県揖保郡太子町矢田部字山本480-14,,,244,116,350
ゴールドキング会館,兵庫県赤穂郡上郡町上郡210,4パチ:144台20スロ:120台,,144,120,200
佐用国際グランプリ,兵庫県佐用郡佐用町横坂善光寺下600-1,,,190,120,450
山光会館,兵庫県佐用郡佐用町横坂400-3,,,,,-
キコーナ香住店,兵庫県美方郡香美町香住区七日市314-1,パチンコ：[4][1]パチスロ：[20],,150,50,120
ベニス奈良南店,奈良県奈良市西九条町5-2-2,4パチ:279台1パチ:136台20スロ:196台5スロ:20台,,420,223,500
ベニス奈良店,奈良県奈良市大安寺町537番地の1,4パチ:144台1パチ:72台20スロ:155台5スロ:29台,400,,,300
マルハン大安寺店,奈良県奈良市大安寺西3-10-5,4パチ:322台1パチ:120台20スロ:200台,,440,200,0
キコーナＪＲ奈良駅前店,奈良県奈良市油阪町2-3,4円パチンコ308台1円パチンコ88台20円スロット132台,,308,132,260
キャラバン,奈良県奈良市西大寺本町1-5,4パチ:-台1.25パチ:-台20スロ:-台,,164,87,-
K-POWERS 大安寺店,奈良県奈良市東九条町1556-6,500円116玉パチンコ：200台500円528玉パチンコ：136台1000円47枚スロット：228台1000円188枚スロット：60台,,376,228,500
昇龍ライト舘　奈良大宮店,奈良県奈良市大宮町7-2-2,0.2パチ:-台1パチ:-台2パチ:-台2.5スロ:-台5スロ:-台10スロ:-台,416,,,200
K-POWERS 西ノ京店,奈良県奈良市西ノ京町143-3,4円Ｐ：176台1円Ｐ：160台20円Ｓ：133台5円Ｓ：17台,,336,150,500
パレス,奈良県奈良市富雄元町2-1-24,4パチ:121台1パチ:66台20スロ:67台,,192,67,34
トリプルスター奈良本店,奈良県奈良市三碓6-1-10,パチンコ４円/１円スロット２０円,,184,92,250
DEME-KING,奈良県奈良市南京終町4丁目342-1,4パチ:-台1パチ:-台20スロ:-台5スロ:-台,255,,,100
ラッキーJR奈良駅前店,奈良県奈良市大宮町1-1-7,,,170,34,無し
カイナラ,奈良県奈良市橋本町22-1,,,102,46,近隣のパーキング等をご利用くださいませ
アクト,奈良県奈良市東向北町29,,,,,-
近鉄センター,奈良県奈良市東向北町28-1,,,114,84,無し
ＶＥＮＩＣＥ柏木店,奈良県奈良市八条5-424-6,,,335,165,350
ニュー大宮,奈良県奈良市大宮町5-3-20,,,,,-
ジャック&ベティ,奈良県大和高田市根成柿420-2,4パチ:64台1パチ:123台2パチ:24台20スロ:48台5スロ:16台,,211,64,280
アロー大和高田店,奈良県大和高田市今里川合方27-1,パチンコ：【4円・1円】パチスロ：【20円・5円】,,200,200,300
アストラ　,奈良県大和高田市春日町2-1-6,4パチ:32台1パチ:110台2パチ:76台5スロ:34台10スロ:35台,,218,69,200
スーパードーム大和高田店,奈良県大和高田市曽大根125-1,,4,,,820
ヒメカンナウ大和高田店,奈良県大和高田市西三倉堂1丁目1番23号,,,,,-
PAO大和小泉店,奈良県大和郡山市小泉町東1-5-6,4パチ:200台1パチ:120台20スロ:217台,,320,216,500
スマイル　ARROW．COM,奈良県大和郡山市筒井町747-1,1パチ:-台2パチ:-台5スロ:-台,,182,60,60
ARROW大和小泉店,奈良県大和郡山市小泉町1239-4,4パチ:-台0.5パチ:-台1パチ:-台20スロ:-台5スロ:-台,,341,133,330
テンイチマックス外川店,奈良県大和郡山市外川町1-42,[4][1]パチ[20][5]スロ,,320,196,500
アッシュ郡山,奈良県大和郡山市白土町218-4,4パチ:144台1パチ:144台20スロ:240台2スロ:72台,,288,312,700
テンイチマックス郡山店,奈良県大和郡山市高田町119-1,,,120,120,200
サイバーパチンコ大和小泉店,奈良県大和郡山市小林町西1丁目2番地の9,,,,,-
マルハン天理店,奈良県天理市三昧田町元西方67-1,４円パチンコ:180台１円パチンコ:160台２０円スロット:80台５円スロット:40台,,360,120,400
マルハン郡山インター店,奈良県天理市南六条町元柳生99-1,4パチ:160台1パチ:160台20スロ:120台5スロ:40台,,320,160,350
ARROW天理店,奈良県天理市嘉幡町700-1,4パチ:-台1パチ:-台20スロ:-台5スロ:-台,,332,176,499
ダイナム奈良天理店　ゆったり館,奈良県天理市田町403番地1,100円/89玉パチ:280台200円/89玉パチ:40台2.247スロ:40台1000円/89枚スロ:120台,,320,160,378
ニューアトム,奈良県天理市柳本町3395-3,,,,,-
123天理店,奈良県天理市三昧田町69－１,,,,,-
マルハン橿原南店,奈良県橿原市膳夫町238-2,4パチ:282台1パチ:81台20スロ:120台,,360,120,413
マルハン橿原北店,奈良県橿原市十市町443,4パチ:400台1パチ:240台20スロ:268台1000円/178枚スロ:62台,,640,330,688
123橿原店,奈良県橿原市葛本町201-2池原観光ビル1F,,4,,,387(テナント敷地内に駐車場有)
K-POWERS橿原店＋MAX SLOT,奈良県橿原市醍醐町384-1,4パチ:120台0.5パチ:40台1パチ:120台5スロ:88台21.277スロ:256台,,0,256,500
SUPER　COSMO　橿原店,奈良県橿原市曽我町42-1,4パチ:315台1パチ:200台20スロ:249台5スロ:41台,,,,-
FACE860橿原,奈良県橿原市小槻町523,,,,,-
ミリオンパートⅢ,奈良県橿原市久米町641-4,,,,,-
ラ・デールパチンコ,奈良県橿原市土橋町333,,,,,-
パーラーPAPARA,奈良県橿原市久米町666-1,,,,,-
デル・ダス,奈良県橿原市四条町627-5,,,,,-
スーパー　コア,奈良県橿原市内膳町5-2-38,,,,,-
岡田会館,奈良県橿原市内膳町5-2-40,,,,,-
ダイナム信頼の森 奈良桜井店,奈良県桜井市大字吉備325番地の3,0.562パチ:40台100円/89玉パチ:240台200円/89玉パチ:40台500円/89枚スロ:20台1000円/89枚スロ:60台,,320,80,有
キコーナ桜井店,奈良県桜井市粟殿1009-1,,,,,-
SUPER　COSMO桜井東店,奈良県桜井市外山25,,,,,-
五條シカゴ,奈良県五條市今井5-24-3,,,,,-
