日の丸パチンコ若松店,千葉県千葉市若葉区若松町2241-1,0.5パチ:18台1パチ:72台2パチ:54台5スロ:60台10スロ:112台,,144,186,250
パチンコパルコ桜木店,千葉県千葉市若葉区桜木1-31-1,4パチ:27台1パチ:81台2パチ:30台20スロ:84台5スロ:23台,,140,108,240
ハップス千城台店,千葉県千葉市若葉区金親町206-13,,,200,50,170
フラミンゴ千葉東店,千葉県千葉市若葉区小倉町779-5,,,156,104,220
フラミンゴ小倉店,千葉県千葉市若葉区小倉町1710-2,,,200,100,180
日の丸パチンコ坂月店,千葉県千葉市若葉区太田町85,,,,,-
アラジン若松店,千葉県千葉市若葉区若松町432-84,,,,,-
VEGA 千葉南店,千葉県千葉市緑区椎名崎町1170,[4パチ]192台[1パチ]96台[20スロ]192台,,288,192,480
ピーアークおゆみ野,千葉県千葉市緑区おゆみ野3-17-6,4パチ:212台1パチ:96台1000円/188枚スロ:7台1000円/47枚スロ:173台,,308,180,350
フラミンゴ椎名崎店,千葉県千葉市緑区椎名崎町谷津162-1,,,272,137,400
誉田スパジオ,千葉県千葉市緑区誉田町2-2303-16,4パチ:116台1パチ:96台20スロ:117台,4,,,432
アイオンおゆみ野店,千葉県千葉市緑区おゆみ野5-48,,,,,-
エリゼあすみが丘店,千葉県千葉市緑区あすみが丘9-1-1,,,,,-
フィーバー,千葉県千葉市緑区大高町41-31,,,,,-
アスワン幕張,千葉県千葉市美浜区幕張西3-1-4,,,408,212,500
稲毛海岸UNO,千葉県千葉市美浜区高洲1-20-1,1000円/480玉パチ:-台500円/120玉パチ:-台1000円/48枚スロ:-台,,346,209,130
メガガイア美浜店,千葉県千葉市美浜区新港45-4,,,,,-
Passion稲毛海岸店,千葉県千葉市美浜区高洲3-23-1,1パチ:143台2.5パチ:32台,,175,96,-
スタジアムポラリス,千葉県千葉市美浜区高洲1-22-21,,,,,-
パールショップともえ新生店,千葉県銚子市新生町1-20-38,4パチ:152台20スロ:76台,,152,76,平面駐車場あり
パールショップともえ銚子今宮店,千葉県銚子市今宮町889,[4][1]パチンコ[20]スロット,,320,200,-
MGM銚子店,千葉県銚子市双葉町5-2,4パチ:-台1パチ:-台20スロ:-台5スロ:-台,4,,,-
ミカド銚子見晴台店,千葉県銚子市長塚町6-4531-1,0.5パチ:40台1パチ:186台2パチ:32台20スロ:50台10スロ:40台,345,,,472
ダイナム千葉銚子店,千葉県銚子市余山町135番地1,4パチ:240台1パチ:120台21.277スロ:120台,,360,120,483
サンラッキー銚子店,千葉県銚子市中央町7-1,,,,,-
パーラーMGM行徳店,千葉県市川市行徳駅前2-3ポニー商業ビルＢ1,パチンコ：[4]291台[1]62台パチスロ：[20]118台,,353,118,無し
本八幡UNO,千葉県市川市八幡2-16-6　八幡ハタビル1Ｆ,1.04パチ:-台1.042パチ:84台4.16パチ:-台1000円/240玉パチ:471台1000円/192枚スロ:25台5.21スロ:-台20.83スロ:-台1000円/48枚スロ:308台,,555,333,提携駐車場177
ルモンドエース市川妙典,千葉県市川市妙典4-1-1,4パチ:232台1パチ:194台5スロ:62台21.277スロ:394台,,394,456,1300
ニュー後楽園市川店,千葉県市川市市川1-1-1,,,383,140,-
D’STATION妙典駅前店,千葉県市川市富浜1-3-20,,609,,,提携駐車場有
東西線,千葉県市川市行徳駅前2-7-5,500円/120玉パチ:210台1000円/48枚スロ:116台,,210,116,提携駐車場有26
ウイング市川駅南店,千葉県市川市市川南1-10-1-116,「4円パチンコ」：200台「1円パチンコ」：74台「20円スロット」：239台「5円スロット」：22台,535,,,-
メッセ行徳店,千葉県市川市行徳駅前1-22-9,【パチスロ】[1000円/47枚]343台[6.25]64台,,0,407,なし
サンパレス本八幡店,千葉県市川市南八幡4-1-12,【4】【1】パチンコ【20】パチスロ,,192,127,三井のリパークにて提携駐車場を完備しております!!詳しくはスタッフ迄!!
パチーノ・ヒノ鬼越店,千葉県市川市北方1-10-15,,,,,-
ハップス市川駅前店,千葉県市川市市川1-4-10,4パチ:220台1パチ:75台20スロ:194台5スロ:34台,,288,226,提携駐車場有
ウエスタン行徳店,千葉県市川市行徳駅前2-16-1,,,155,99,提携駐車場有り
パシオン南行徳店,千葉県市川市相之川4-9-1,,,192,84,-
ガイアネクスト行徳店,千葉県市川市行徳駅前1-25-1,,,,,-
ピーアーク南行徳NEO,千葉県市川市相之川4-8-8,,,,,-
ジャンボ本八幡店,千葉県市川市南八幡4-7-16,,,,,-
マックスワン,千葉県市川市南行徳1-20-16,,,,,-
ピーアーク本八幡,千葉県市川市八幡2-15-10　パティオＢ1Ｆ,,,,,-
八幡メトロ,千葉県市川市南八幡4-2-13,,,,,-
ガイア南行徳店,千葉県市川市相之川4-6-14,,,,,-
ジャック＆ベティ市川店,千葉県市川市鬼高3-28-16ショップス市川2Ｆ,,,,,-
メガオアゾ南行徳店,千葉県市川市南行徳1-20-15,,,155,110,57
ジャラコ南行徳店,千葉県市川市相之川4-15-10,,,,,-
ライジング習志野,千葉県船橋市習志野4-128-1,4パチ:200台0.5パチ:40台1パチ:160台20スロ:152台5スロ:88台,,400,240,-
MEGA GODDESS,千葉県船橋市本町4-1-20,20スロ:456台,,0,456,-
クリエ船橋競馬場店,千葉県船橋市宮本9-9-10,4パチ:180台1パチ:120台1000円/47枚スロ:300台,,300,300,335
ミリオン習志野店,千葉県船橋市習志野4-7-2,4パチ:400台1パチ:160台20スロ:140台5スロ:20台,,560,160,550
パチンコ遊技座,千葉県船橋市習志野台2-6-17 埼協ビル1階,4パチ:151台200円/150玉パチ:190台,,341,0,地下駐車場14提携ASパーキング77ナビパーク習志野第1110
SLOT YUGIZA(スロット遊技座),千葉県船橋市習志野台2-6-17 埼協ビル4F・5F,,,0,144,地下駐車場14提携ASパーキング77ナビパーク習志野第1110
パチンコキング中山店,千葉県船橋市本中山2-17-35,4パチ:133台1パチ:120台20スロ:133台,,254,133,-
アスワンＱＰ,千葉県船橋市米ヶ崎町563-5,,,342,201,500
百万弗アネックス,千葉県船橋市本町5-1-17,5スロ:-台21.277スロ:-台,1000,,,近くにパーキングがたくさんあります。
アスワンFUNABASHI,千葉県船橋市海神町3-2377-1,,,0,143,-
西船橋スターダスト,千葉県船橋市印内町601-1,,,362,215,第一駐車場・第二駐車場合わせて127
ミラージュ/ミラージュアネックス,千葉県船橋市本中山7-9-6,1000円/240玉パチ:176台21.277スロ:165台,,176,165,40以上
ルーキー,千葉県船橋市本町4-44-2,,,0,98,-
パラッツォ船橋店,千葉県船橋市本町1-6-12,4パチ:394台1パチ:278台20スロ:290台5スロ:104台10スロ:48台,,675,442,1000
第一プラザ船橋店,千葉県船橋市本町7-27-27,4円パチンコ1円パチンコ20円スロット10円スロット5円スロット2円スロット,,440,200,300
パーラーウェーブ薬円台,千葉県船橋市薬円台6-6-6,4パチ:143台20スロ:127台,,144,127,100
MEGA ANGEL,千葉県船橋市本町4-2-15,10スロ:-台,,0,72,-
スロットスーパーZX,千葉県船橋市習志野4-16-7,20スロ:322台2.5スロ:12台5スロ:52台,386,,,230
オリンパス,千葉県船橋市本町1-3-1,,,,,-
ガイアネクスト海神,千葉県船橋市海神町南1-1556-2,,,,,-
ニューシグナル,千葉県船橋市古和釜町846-1,,,,,-
ガイア西船橋店​,千葉県船橋市本郷町465-1,,,,,-
ハップス三咲店,千葉県船橋市みやぎ台3-4-22,4パチ:-台1パチ:-台20スロ:-台5スロ:-台,,200,97,300
MEGA DIVAS’,千葉県船橋市本町4-1-15,4パチ:-台0.25パチ:-台1パチ:-台,4,,,なし
Passion　二和向台店,千葉県船橋市二和西6-26-27,4パチ:95台0.5パチ:31台1.25パチ:103台2スロ:25台21.277スロ:94台,4,,,300完備
ガイア藤原スロット館,千葉県船橋市藤原4-9-28,,,,,-
ウエスタン原木店,千葉県船橋市本中山7-54-3,,,90,65,9
トワーズ船橋店,千葉県船橋市習志野台8-59-1,,,384,256,450
フラミンゴ藤原店,千葉県船橋市藤原6-28-11,4パチ:-台1パチ:-台20スロ:-台,,416,158,400
00°8フェリア,千葉県船橋市市場5-16-23,,,,,-
津田沼ニュータイガー,千葉県船橋市前原西2-13-11,,,,,-
テキサス北習志野,千葉県船橋市習志野台2-6-5,,,,,-
パチーノヒノ船橋店,千葉県船橋市藤原5-6-7日野ビル,,,,,-
百万弗中山店,千葉県船橋市本中山2-18-10,,,,,-
平楽会館,千葉県船橋市習志野台2-6-3,,,,,-
ボン西船店,千葉県船橋市西船4-27-3,,,,,-
イリス船橋店,千葉県船橋市本町4-44-35,,,,,-
ウィンベルカザン,千葉県船橋市藤原3-18-21,,,,,-
GOLD7,千葉県船橋市三咲9-1-15,,,,,-
百万弗,千葉県船橋市本町4-5-27,,,,,-
ダイナム千葉館山店,千葉県館山市八幡字沼田246番地,4パチ:240台1パチ:120台1000円/48枚スロ:120台,,360,120,484
SKIP館山店,千葉県館山市湊231,,,640,272,786
ヒルトン,千葉県館山市安布里221,,,,,-
ニュースポーツランド,千葉県館山市安布里164-2,,,,,-
パチンコ　オークラ,千葉県館山市正木588-1,,,,,-
パールショップともえ木更津店,千葉県木更津市中里字光600-1,4パチ:160台5スロ:39台21.277スロ:-台,,160,414,600
メトロ清見台店,千葉県木更津市清見台南5-1-35,4パチ:337台1パチ:99台20スロ:235台5スロ:20台,,460,260,520
ダイエー木更津店,千葉県木更津市江川字野際291番地14,,,640,320,1045
プラザDO木更津店,千葉県木更津市請西1-24-20,,,588,412,-
スマイルマックス木更津,千葉県木更津市桜井新町2-2-3,,,,,-
パーラードリーム,千葉県木更津市東中央1-4-3,4パチ:-台,,116,50,15
プラザDo長須賀店,千葉県木更津市長須賀2021-1,,,,,-
メダル王,千葉県木更津市長須賀298-1,,,,,-
アルファ　in,千葉県木更津市真里1844番地の1,,,,,-
パラッツォ馬橋中根長津店,千葉県松戸市中根長津町245,4パチ:124台1パチ:77台20スロ:296台5スロ:44台10スロ:28台,,201,373,374
ゴールド,千葉県松戸市上本郷857−2,,,131,86,35
マルハン松飛台店,千葉県松戸市松飛台261-2,4パチ:201台1パチ:160台20スロ:160台5スロ:40台,,360,200,415
マルキ松戸店,千葉県松戸市金ヶ作海道408-80,4パチ:88台1パチ:132台0.5パチ:40台20スロ:154台5スロ:34台,,0,188,100
エクス・アリーナ松戸,千葉県松戸市高塚新田326‐5,4パチ:342台1パチ:114台20スロ:274台,730,,,530
サントロペ松戸店,千葉県松戸市松戸1287-1サントロペビル松戸1Ｆ,4パチ:260台1パチ:51台20スロ:135台,4,,,100
パラッツォ馬橋駅前店,千葉県松戸市西馬橋蔵元町3-1,4パチ:304台1パチ:319台20スロ:183台5スロ:63台,,623,246,214
ときわホール,千葉県松戸市本町２０−１３,,,270,158,-
パールショップともえ松戸店,千葉県松戸市串崎新田162-1,4パチ:499台1パチ:108台20スロ:428台,,608,428,680
アポロスロット,千葉県松戸市東平賀仲通245-15,21.277スロ:111台,111,,,140
ロータス,千葉県松戸市小金きよしケ丘1-1-1,4パチ:154台200円/150玉パチ:34台,,188,0,140
八柱UNO,千葉県松戸市日暮1-7-10 八柱UNOビル1階・2階,500円/120玉パチ:194台200円/192玉パチ:82台1000円/48枚スロ:229台1000円/192枚スロ:40台,,276,269,100(提携駐車場70)
ユーコーラッキー松戸店,千葉県松戸市本町22-1,4パチ:211台1パチ:71台20スロ:206台5スロ:26台,4,,,提携駐車場有り。松戸西口パーキング/松戸パーキング/松戸西口地下駐車場
キコーナ松戸店,千葉県松戸市松戸新田58番地の1,,,560,440,630
キングイーグルズ馬橋店,千葉県松戸市馬橋116-1,1パチ:115台2パチ:22台20スロ:49台2.5スロ:24台10スロ:84台,,137,157,-
グランド馬橋,千葉県松戸市西馬橋幸町60-1,4パチ:48台1パチ:39台1000円/200枚スロ:29台1000円/50枚スロ:98台,128,,,180
ガーデン松戸,千葉県松戸市稔台3-40-1第2駿河ビル,4パチ:127台1パチ:255台20スロ:187台2スロ:16台5スロ:48台,,384,256,420
ガーデン松戸金ヶ作,千葉県松戸市金ヶ作269-10,0.2パチ:36台1.04パチ:227台4.16パチ:37台1000円/192枚スロ:50台1000円/48枚スロ:110台,,300,160,251
楽園松戸店,千葉県松戸市本町15-4ハマトモビル,[4][1]パチ[20][10][5]スロ,4,,,提携駐車場有(松戸駅周辺のタイムズ・NPC松戸西口パーキング・松戸パーキング)
六実グランド,千葉県松戸市六実5-26-5,4パチ:64台1.33パチ:128台,,216,34,-
スロットゼウス松戸店,千葉県松戸市殿平賀192,21.277スロ:162台,,0,162,100
テンイチ∞新松戸店,千葉県松戸市新松戸1-426,1000円/50枚スロ:-台1000円/47枚スロ:-台,,0,201,無し
夢屋五香店,千葉県松戸市常盤平5-23-1,,,252,84,91
ザ･ガーデン,千葉県松戸市高塚新田337-9,4パチ:-台1パチ:-台20スロ:92台5スロ:28台,,320,120,356
キコーナ八柱店,千葉県松戸市日暮1-16-11シルバービル,20スロ:165台,,0,166,30
松戸屋,千葉県松戸市新松戸2-16,,,,,-
パチスロアーク新松戸店,千葉県松戸市新松戸1-428,20スロ:-台,,0,116,-
パーラー百万弗,千葉県松戸市松戸1231,,,251,120,-
アムディ東松戸,千葉県松戸市紙敷171-1　　,,,400,180,450
パチスロクィーン,千葉県松戸市新松戸4-44,20スロ:-台,,0,60,150
キングコング,千葉県松戸市五香1-1-6,,,,,-
ピーステージマックス,千葉県松戸市新松戸4-42,,,,,-
馬橋会館,千葉県松戸市馬橋1896-9,,,,,-
バロンタウン新松戸店,千葉県松戸市新松戸2-107,,,,,-
パーラー百万弗上本郷店,千葉県松戸市仲井町3-7,,,,,-
エリア,千葉県松戸市小金きよしケ丘1-1-4,,,,,-
あかね常盤平店,千葉県松戸市常盤平2-8,,,,,-
ハリウッド野田,千葉県野田市蕃昌359-3,4パチ:320台1パチ:96台20スロ:194台,,416,194,737
パーラージュピター関宿店,千葉県野田市次木76,4パチ:36台0.4パチ:108台1パチ:138台20スロ:96台2スロ:32台,,288,128,350
フェスタ･野田店,千葉県野田市七光台358,4円パチンコ、1円パチンコ、20円スロット、2円スロット,640,,,531
宇宙センター梅郷店,千葉県野田市山崎1913-4,4パチ:-台1パチ:-台20スロ:-台5スロ:-台,,233,166,357
国際センター七光台店,千葉県野田市吉春字鎌田864番地,,,154,84,180
ＳＡＰ野田,千葉県野田市中野台815,4パチ:153台1パチ:144台20スロ:185台5スロ:52台1000円/47枚スロ:49台,,297,286,400
グレードワンＲ16,千葉県野田市蕃昌252-181,,,,,-
マルキンあたご店,千葉県野田市野田755,,,,,100
アムディ野田,千葉県野田市上三ヶ尾198-34,,,440,200,600
ＣＨＡＬＬＥＮＧＥＲ,千葉県野田市中里621-1,4パチ:-台1パチ:-台20スロ:-台2スロ:-台,,318,180,450
Ｍ－１野田店,千葉県野田市目吹1575-1,,,321,66,-
太平プレイランド関宿店,千葉県野田市木間ヶ瀬4949-1,,,,,-
アカデミー,千葉県野田市木間ヶ瀬1000-1,,,,,-
Ｐ－ＴＩＭＥ,千葉県野田市柳沢246,,,76,160,150
マルハン茂原店,千葉県茂原市腰当515,4パチ:320台1パチ:160台21.27スロ:216台※遊技金額、アイコン表示設定にて設定された金額が表示されます。設定はアイコン管理ページより設定ください,,480,216,690
アップル茂原店,千葉県茂原市新小轡23-1,,,400,240,600
ヒノックス茂原店,千葉県茂原市高師1702,1パチ:164台2パチ:124台4パチ:28台5スロ:20台21.277スロ:138台,,316,158,300
ジャック＆ベティ茂原店,千葉県茂原市小轡字勢出770-3,4パチ:320台1パチ:160台20スロ:160台,,480,160,600
茂原スパジオ,千葉県茂原市法目935番地1,4パチ:227台1パチ:100台20スロ:101台,,432,120,498
ダイナム千葉茂原店　ゆったり館,千葉県茂原市小林字野中 1627番地2,1パチ:256台2パチ:64台10スロ:192台,,256,192,335
ピラミッド,千葉県茂原市大芝33-1,4パチ:180台1パチ:108台20スロ:111台5スロ:47台,446,,,400
ピーワン,千葉県茂原市高田564番地1,,,,,-
トワーズ茂原店,千葉県茂原市早野2129-3,,,440,200,500
777ニューみやこ,千葉県茂原市綱島880-1,,,,,-
グローブ,千葉県茂原市東茂原15-18,,,,,-
Vmax,千葉県茂原市内長谷416-5,,,,,-
プレゴ成田店,千葉県成田市ウイング土屋80番地HUMAXパビリオン成田1F,,,480,294,1400
パールショップともえ成田９６９,千葉県成田市花崎町793-1,[4]パチ[1]パチ[20]スロ[5]スロ[2]スロ,,432,537,850
パーラーMGM成田店,千葉県成田市ウイング土屋196,4パチ:-台1パチ:-台20スロ:-台,4252,,,450
サンラッキー成田店,千葉県成田市飯仲１５−９,,,,,-
D’STATION佐倉店,千葉県佐倉市六崎167-6,4パチ:322台1パチ:200台5スロ:25台21.277スロ:284台,,522,309,560
夢会館,千葉県佐倉市王子台3-1-3,4パチ:102台1パチ:51台1000円/47枚スロ:63台,,151,67,110
パラッツォ志津店,千葉県佐倉市上志津1663-16志津ステーションビル1Ｆ,4パチ:298台1パチ:366台20スロ:366台2スロ:21台5スロ:57台10スロ:30台,,690,474,510
ピーアークピーくんクラブS,千葉県佐倉市上座字西谷津649-5,1000円/470枚スロ:14台1000円/188枚スロ:56台1000円/94枚スロ:16台1000円/47枚スロ:164台,,0,250,450
ピーアークピーくんクラブＰ,千葉県佐倉市ユーカリが丘3-2-1,,,,,-
ウエスタン佐倉店,千葉県佐倉市栄町15-4,,,0,139,83+多数提携駐車場完備!駐車場に関するお問い合わせはお気軽にスタッフまで!!
フラミンゴ千代田店,千葉県佐倉市吉見1255-1,4パチ:-台1パチ:-台20スロ:-台5スロ:-台,499,,,300
ドラゴン臼井店,千葉県佐倉市王子台1-22-7,,,146,69,50
D’STATION東金店,千葉県東金市田間1302-2,,,444,303,-
パールショップともえ東金ＳｉｄｅⅡ,千葉県東金市田間１３３３−５,4パチ:240台1パチ:60台1000円/47枚スロ:200台,,300,200,大型平面駐車場あり
あたりや東金店,千葉県東金市押堀737,4パチ:320台1パチ:160台2スロ:9台1000円/47枚スロ:215台,,480,240,-
山田スパジオ,千葉県東金市山田1155-1,4パチ:213台1パチ:108台20スロ:128台5スロ:36台,,324,180,545
ヴィーナス東金店,千葉県東金市道庭字塚田938,4パチ:128台0.2パチ:62台1.25パチ:194台20スロ:160台2.5スロ:32台10スロ:64台,,384,256,650
パーラーMGM東金店,千葉県東金市道庭600番地,0.2パチ:-台1パチ:-台2パチ:-台2スロ:-台10スロ:-台,,384,128,500
ダイナム千葉東金店,千葉県東金市福俵字駅前102番地1,4パチ:200台1パチ:160台20スロ:120台,,360,120,486
フラミンゴ東金店,千葉県東金市薄島字小沼554-1,,,240,71,303
パールショップともえ旭店,千葉県旭市ニ３３−１,4パチ:248台1パチ:86台5スロ:64台1000円/47枚スロ:186台,,334,251,600
D’STATION旭店,千葉県旭市イ4212-20,4パチ:196台0.5パチ:40台1パチ:238台2.5スロ:40台5スロ:40台21.277スロ:221台21.28スロ:-台,,474,301,640
ハッピーランド旭店,千葉県旭市ニ－365,4パチ:51台1.25パチ:148台20スロ:107台2スロ:22台5スロ:27台,,256,192,500
ヴィーナス海上店,千葉県旭市後草1376-3,2.2スロ:-台5.5スロ:-台21.2スロ:-台,,224,173,350
パーラーフェニックス旭店,千葉県旭市二の2737-1,4パチ:132台0.22パチ:22台1.11パチ:88台5スロ:24台1000円/47枚スロ:96台,,242,120,350
ダイナム千葉旭店　ゆったり館,千葉県旭市川口字及内3397番地2,1パチ:280台2パチ:40台5スロ:40台10スロ:120台,,320,160,480
ダイナム千葉海上店　ゆったり館,千葉県旭市後草1226番地,1パチ:280台2パチ:40台5スロ:80台10スロ:80台,,320,160,484
ヴィーナス旭店,千葉県旭市二の3250,4パチ:18台0.2パチ:18台1.25パチ:104台20スロ:55台6.25スロ:35台,,142,96,200
マルハン習志野店,千葉県習志野市屋敷4-3-2,4パチ:396台1パチ:180台20スロ:352台,,576,352,734
ニュー後楽園,千葉県習志野市津田沼1-2-13,,,291,144,無し
ＶＺＯＮＥ津田沼店,千葉県習志野市谷津7-8-3,,,148,83,無し
PIA津田沼,千葉県習志野市津田沼1-2-1,,,,,-
ニュークラウン津田沼店,千葉県習志野市津田沼1-11-21,,,,,-
ＺＡＰ習志野店,千葉県習志野市大久保1-28-9,,,,,-
会津屋,千葉県習志野市大久保1-27-5,,,,,-
やすだ柏店,千葉県柏市十余二240-1,4パチ:320台1パチ:96台0.2パチ:32台20スロ:128台5スロ:31台2スロ:32台,,448,192,551
マルハン柏店,千葉県柏市十余二249-5,4パチ:442台1パチ:184台20スロ:336台5スロ:80台,,624,416,1000
楽園柏店,千葉県柏市柏1-3-1-Ｂ1Ｆ,[4][1]パチ[20]スロ,,0,447,提携駐車場:柏市市営駐車場・中央町パーキング・NPC柏駅東口パーキング・タイムズ柏中央町駐車場
P・S シルバー,千葉県柏市北柏1-1-16,4パチ:51台1パチ:52台20スロ:85台,4,,,32提携駐車場有
南柏UNO,千葉県柏市南柏1-6-1,パチンコ：[500円/120玉][500円/240玉]パチスロ：[1000円/48枚],,384,216,300
アリーナ柏店,千葉県柏市酒井根753-2,4パチ:440台1パチ:160台20スロ:320台,,440,320,820
ヒノマル新柏店,千葉県柏市新柏1-1-9,4パチ:-台1パチ:-台20.83スロ:-台,,260,216,280
キコーナ柏店​,千葉県柏市若柴358-8​,,,212,145,203
一番舘柏店,千葉県柏市豊四季341-8,4パチ:240台1パチ:120台20スロ:244台2スロ:36台,640,,,400
寿楽南柏店,千葉県柏市南柏1-2-7,0.2パチ:-台0.5パチ:-台1パチ:-台5スロ:-台,,160,38,-
寿楽柏店,千葉県柏市末広町7-19,4パチ:-台0.5パチ:-台1パチ:-台20スロ:-台5スロ:-台,,248,163,-
PIA柏スロット館,千葉県柏市柏1-2-31柏共同ビル地下1F,,,,,-
PIA柏 本館,千葉県柏市柏1-2-7谷川ビル3Ｆ,,,,,-
PIA柏 パチンコ館,千葉県柏市柏1-2-8,,,,,-
マルキンかしわ店,千葉県柏市末広町4-2,,,,,-
マルキン松ヶ崎店,千葉県柏市松ヶ崎435-1,,,,,329
マルキン北柏店,千葉県柏市根戸483,,,,,180
ＶＺＯＮＥ柏店,千葉県柏市五條谷134-5,,,324,175,450
ガイア増尾店,千葉県柏市増尾1-1-25,,,,,-
ニューヤマト,千葉県柏市高柳815-1,,,,,-
ジョイ日華,千葉県柏市増尾1139,,,,,-
PANDORA柏高田店,千葉県柏市高田1332-5,,,,,-
zetton,千葉県勝浦市浜勝浦445,,,,,-
ニューカツウラ,千葉県勝浦市勝浦11-1,,,,,-
ＨＩＮＯＭＡＲＵ姉崎駅前店,千葉県市原市姉崎524-8,,,,,116
日の丸パチンコ五井駅西口店,千葉県市原市五井中央西2-1-2,4パチ:105台1パチ:161台1000円/47枚スロ:163台1000円/186枚スロ:40台,,266,203,156
マルハン市原店,千葉県市原市八幡浦1-4-7,4パチ:496台1パチ:190台21.27スロ:416台,,684,416,900
パールショップともえ市原店,千葉県市原市惣社574-1,4パチ:-台1000円/47枚スロ:328台,,432,328,大型平面駐車場
ヴィーナス,千葉県市原市青柳2-8-3,1000円/188枚スロ:28台1000円/47枚スロ:196台,224,,,240
サンシャインコスモ,千葉県市原市玉前西1-1-12,100円/25玉パチ:-台21.277スロ:-台,,250,153,400
日の丸パチンコ辰巳店,千葉県市原市市原500-1,4パチ:217台1パチ:148台0.5パチ:23台20スロ:147台5スロ:51台,,388,198,530
サンシャインMAX,千葉県市原市五井金杉1-32-3,4パチ:336台1パチ:199台21.277スロ:266台,,534,273,650
ひのまる海士有木店,千葉県市原市海士有木1743,1パチ:72台2パチ:168台20スロ:48台10スロ:99台,,240,147,400
ABC八幡店,千葉県市原市五所88-1,4パチ:-台1パチ:-台2パチ:-台20スロ:-台2スロ:-台,,192,98,314
パーラーDAIKI市原店,千葉県市原市八幡973,,,,,-
 メガサイバースロットパチンコ市原店,千葉県市原市八幡海岸通1932-28,,,,,-
パーラークレスト姉崎店,千葉県市原市姉崎海岸71-1,,,388,138,500
パチンコユートピア,千葉県市原市姉崎720-2,,,221,90,200
パチンコ　コア,千葉県市原市中164-1,20スロ:-台,,110,60,200
五井ゲームセンター,千葉県市原市五井中央西1-2-6,,,,,-
メトロ潮見通り店,千葉県市原市青柳北4-7-1,,,,,-
P-MAX,千葉県市原市馬立1594-1,,,,,-
パチーノ・ヒノ市原店,千葉県市原市八幡海岸通72-1,,,,,-
メトロ市原店,千葉県市原市古市場18,,,,,-
アルファブイ,千葉県市原市白金町2-36,,,,,-
タツミパーク,千葉県市原市辰巳台西1-9-1,,,,,-
やすだ南流山店,千葉県流山市南流山1-9-17,4パチ:138台1パチ:96台20スロ:72台2スロ:21台,,234,93,166
宇宙センター流山店,千葉県流山市駒木台206,4パチ:-台1パチ:-台20スロ:-台5スロ:-台,,,,-
チャレンジャー流山店,千葉県流山市桐ヶ谷241-1,,,,,-
パチンコメジャー,千葉県流山市西初石3-106-5,,,,,-
ミスターパチンコ流山店,千葉県流山市平和台3-8-1,,,,,-
江戸川台センター,千葉県流山市江戸川台東1-7,,,,,-
P・寿限無南流山店,千葉県流山市南流山1-8-8,,,,,-
マルハン八千代緑が丘店,千葉県八千代市緑が丘西2丁目13番地3,4パチ:462台1パチ:252台5スロ:45台21.27スロ:365台,,712,410,1284
マルハン八千代東店,千葉県八千代市上高野1505-3,4パチ:241台1パチ:120台20スロ:120台,,360,120,412
ABCホール,千葉県八千代市大和田560-1,,,97,64,75
