マリオンガーデン岐阜本店,岐阜県本巣市小柿813,,1221,,,1000
グランワールドカップ本巣店,岐阜県本巣市小柿７７４,,,800,400,-
ダイナム岐阜本巣店　ゆったり館,岐阜県本巣市温井57番地1,1パチ:279台2パチ:80台10スロ:117台,,360,120,380
キング,岐阜県郡上市八幡町稲成１９６－１,４円１円ぱちんこ２０円スロット,100,,,100
ハッチー白鳥店,岐阜県郡上市白鳥町為真953,4パチ:49台1パチ:21台20スロ:15台,,85,15,60
ロイヤル５５５郡上店,岐阜県郡上市八幡町稲成字一段畑1031‐1,,,400,155,400
パチンコセブン,岐阜県郡上市白鳥町向小駄良730-3,,,,,-
ラッキー,岐阜県郡上市八幡町島谷1099-1,,,,,-
スペースファン,岐阜県郡上市白鳥町向小駄良729-1,,,,,-
7プラザ,岐阜県下呂市萩原町上呂2092-2,,4,,,-
プレイタウンG1,岐阜県下呂市森971-54,4パチ:52台1パチ:84台20スロ:35台,4,,,-
プレイタウン遊7,岐阜県下呂市萩原町花池145-1,4パチ:-台1.25パチ:-台20スロ:-台,4,,,-
パーラーサンキュウ,岐阜県下呂市萩原町大ヶ洞922,,,,,-
パーラーポパイ平田店,岐阜県海津市平田町仏師川590-1,4パチ:-台0.5パチ:-台1パチ:-台10スロ:-台,,203,52,200
太陽会館,岐阜県海津市海津町馬目109,,,,,-
フィット桜丘店,岐阜県海津市南濃町松山390,,,,,-
マリオン名岐バイパス店,岐阜県羽島郡笠松町円城寺1450-1,パチンコ【0.2】【0.5】【1】【2】スロット【2】【5】【10】,,340,211,347
アヅマぎなん店,岐阜県羽島郡岐南町上印食8-72,,,,,-
ダイナム岐阜養老店,岐阜県養老郡養老町宇田字郷勺594番地1,1.042パチ:160台4.167パチ:200台1000円/48枚スロ:117台,,360,120,525
がちゃぽん垂井店,岐阜県不破郡垂井町綾戸字不破ノ初350-1,4パチ:280台1パチ:200台20スロ:240台5スロ:60台,780,,,630
ウイング垂井店,岐阜県不破郡垂井町表佐1-2,「4円パチンコ」：200台「1円パチンコ」：200台「20円スロット」：200台「2円スロット」：40台,640,,,450分
パチンコ富士養老店,岐阜県安八郡輪之内町塩喰2472,4パチ:224台1パチ:224台20スロ:192台5スロ:32台,672,,,800
MGM大垣店,岐阜県安八郡輪之内町塩喰字西本田2501-1,,,,,-
SLOT Major OONO,岐阜県揖斐郡大野町大字黒野字干物112-1,20スロ:-台5スロ:-台,,0,150,-
ウイング池田南店,岐阜県揖斐郡池田町八幡2504,「4円パチンコ」：200台「1円パチンコ」：240台「0.2円パチンコ」：40台「1000円/47枚貸スロット」：216台「5円スロット」：44台,740,,,558分
ＳＵＮ池田店,岐阜県揖斐郡池田町本郷441-7,4パチ:240台0.5パチ:40台1パチ:200台1000円/188枚スロ:38台1000円/47枚スロ:190台,,480,228,650
ゴールドタイガー,岐阜県揖斐郡大野町大字瀬古81,,,,,-
ウイング池田店,岐阜県揖斐郡池田町本郷621-1,,,,,-
一Qさん,岐阜県揖斐郡大野町黒野1645,,,,,-
ビッグマックス北方店,岐阜県本巣郡北方町栄町一丁目1番地,,,576,256,750
スロットマックス高屋店,岐阜県本巣郡北方町高屋伊勢田2-50,6.061スロ:64台10スロ:128台,,0,192,192
グランプリ北方店,岐阜県本巣郡北方町高屋伊勢田2-8,,,,,-
ZENT坂祝店,岐阜県加茂郡坂祝町大針字尾橋728-1,4パチ:480台1.25パチ:120台2パチ:40台21.277スロ:380台,1040,,,-
プレーランドリバーサイド,岐阜県加茂郡白川町河岐1705-2,,,218,42,170
スクエア アクア,岐阜県可児郡御嵩町上恵土405-1,4パチ:-台0.5パチ:-台1パチ:-台20スロ:-台5スロ:-台,,320,160,400
ウイング御嵩店,岐阜県可児郡御嵩町古屋敷字中屋敷739-1,「4円パチンコ」：180台「1円パチンコ」：180台「20円スロット」：126台「5円スロット」：18台,504,,,460分
アプリイ沓谷,静岡県静岡市葵区沓谷5-11-2,,430,,,-
ABC静岡柳町店,静岡県静岡市葵区柳町65-1,4パチ:160台1パチ:160台20スロ:130台5スロ:30台,,320,160,357
マルハン水道町店,静岡県静岡市葵区水道町121-1,4パチ:120台1パチ:160台2パチ:40台20スロ:80台5スロ:40台10スロ:40台,,320,160,400
LAS VEGAS静岡店,静岡県静岡市葵区伝馬町1−2 ホテルシティオ安田屋ビル B1F ,20スロ:121台5スロ:25台,146,,,契約駐車場(ペガサート駐車場)の状況によります
アプリイ瀬名川,静岡県静岡市葵区瀬名川3-4-15,100円/90玉パチ:180台500円/225玉パチ:108台メダル1枚2.22円貸スロ:18台1000円/180枚スロ:33台1000円/90枚スロ:108台,,288,159,300
パチンコプラザ瀬名店,静岡県静岡市葵区瀬名川1-31-1,4パチ:225台1パチ:72台20スロ:143台,,297,142,260
コンコルド静岡紺屋町店1・2,静岡県静岡市葵区紺屋町2-8,4パチ:200台1パチ:80台20スロ:141台5スロ:27台10スロ:28台,476,,,-
ローレル東千代田店,静岡県静岡市葵区東千代田3-7-22,[4]パチ１５２台[1]パチ１５２台[20]スロ１２４台,,304,124,240
アプリイ千代,静岡県静岡市葵区千代1-13-33,100円/90玉パチ:134台500円/225玉パチ:178台20スロ:79台5スロ:36台,,324,117,300
アプリイ新伝馬,静岡県静岡市葵区新伝馬1-4-32,4パチ:316台100円/90玉パチ:204台1000円/180枚スロ:36台21.277スロ:231台,,524,276,560
ブレイヴ水道町店,静岡県静岡市葵区水道町131,1.111パチ:73台500円/225玉パチ:108台100円/30玉パチ:36台10スロ:144台,,216,144,250
エコP&S七間町店,静岡県静岡市葵区七間町４,1パチ:106台2パチ:36台20スロ:57台2スロ:14台,1,,,なし
パチンコ芙蓉伊呂波町店,静岡県静岡市葵区伊呂波町4-15,,,,,-
パチンコ芙蓉神明町店,静岡県静岡市葵区神明町71-1,,,,,-
コンコルド静岡駅前店,静岡県静岡市駿河区南町16-1,,,192,88,-
ABC静岡寿町店,静岡県静岡市駿河区寿町14-14,4パチ:240台1パチ:240台20スロ:240台5スロ:80台,,480,320,625
ＡＢＣ静岡中吉田店,静岡県静岡市駿河区中吉田8ｰ10,4パチ:256台1パチ:256台2パチ:64台20スロ:311台5スロ:92台,,576,403,809
マルハン東新田店,静岡県静岡市駿河区東新田1-12-3,4パチ:200台1パチ:120台20スロ:80台5スロ:80台,,320,160,400
マルハンメガシティ静岡,静岡県静岡市駿河区富士見台1-4-85,4パチ:600台1パチ:280台1000円/47枚スロ:400台1000円/190枚スロ:46台,,880,446,900
コンコルド静岡豊田店,静岡県静岡市駿河区豊田3-4-46,4パチ:120台1パチ:80台20スロ:72台5スロ:36台,,200,108,268
コンコルド静岡緑が丘店,静岡県静岡市駿河区緑が丘町4-16,1000円232玉パチンコ1000円930玉パチンコ1000円47枚スロット1000円190枚スロット,1011,,,立体駐車場完備全591
パチンコミマツホール,静岡県静岡市駿河区下川原5-36-25,2パチ:181台10スロ:104台,,182,104,300
SUPER CONCORDE,静岡県静岡市駿河区曲金7-8-22,200円/186玉パチ:206台500円/116玉パチ:524台1000円/190枚スロ:71台1000円/47枚スロ:576台,1377,,,1055
アプリイ富士見台,静岡県静岡市駿河区富士見台2-33-1,100円/90玉パチ:261台100円/45玉パチ:50台1000円/180枚スロ:46台1000円/90枚スロ:144台,,311,190,355
アプリイ中原,静岡県静岡市駿河区中原153,4パチ:432台1パチ:203台1000円/47枚スロ:396台1000円/200枚スロ:15台1000円/500枚スロ:15台,,635,426,800
コンコルド静岡手越店,静岡県静岡市駿河区向手越1-11-1,4パチ:144台1パチ:96台20スロ:40台5スロ:40台,,240,80,パチンコ240/スロット80
コンコルド静岡東新田店,静岡県静岡市駿河区東新田4-19-30,4パチ:200台1パチ:160台20スロ:120台5スロ:80台,,360,200,490
やすみ時間静岡東店,静岡県静岡市駿河区池田162,,,,,-
パチンコ芙蓉丸子店,静岡県静岡市駿河区丸子3-13-1,,,,,-
ABC清水袖師町店,静岡県静岡市清水区袖師町1877-12,4パチ:160台1パチ:240台20スロ:120台5スロ:40台,,400,160,437
ラッキー会館,静岡県静岡市清水区辻1-9-7,4パチ:72台1パチ:224台20スロ:66台,363,,,200
マルハン村松店,静岡県静岡市清水区清開2-41-20,[4][1]パチ[21.27][5.26]スロ,,507,246,531
マルハン鳥坂店,静岡県静岡市清水区鳥坂588-1,4パチ:201台1パチ:120台20スロ:120台5スロ:40台,,320,160,500
マルハン袖師店,静岡県静岡市清水区袖師町1877-37,4パチ:212台1パチ:180台1000円/190枚スロ:36台1000円/47枚スロ:184台,,392,220,430
ラッキープラザ千歳町店,静岡県静岡市清水区千歳町4-25,4パチ:113台1パチ:110台20スロ:114台,,228,114,201
ラッキープラザ駒越店,静岡県静岡市清水区駒越北町5-4,[4][1]パチ[20]スロ,,228,114,250
ラスベガス 清水店,静岡県静岡市清水区清水村松地先新田41-12,20スロ:195台,195,,,180
パチンコプラザ袖師,静岡県静岡市清水区袖師町982-2,4パチ:566台1パチ:278台2パチ:55台20スロ:282台5スロ:57台,,448,168,535
コンコルド清水大曲店,静岡県静岡市清水区東大曲町8-33,4パチ:400台1パチ:200台2パチ:40台20スロ:320台5スロ:40台10スロ:40台,1040,,,810(大型立体駐車場を完備しておりますので、雨の日も快適に入場できます)
ニューマイニチ,静岡県静岡市清水区西大曲町1-8,4パチ:120台1パチ:120台5スロ:40台21.277スロ:80台,,240,120,187
パチンコ芙蓉草薙店,静岡県静岡市清水区草薙1-2-26,,,,,-
ガイア清水堀込,静岡県静岡市清水区堀込177-1,,,,,-
コンコルド浜松木戸店,静岡県浜松市中区木戸町1-17,,,600,440,-733
マルハン浜松泉店,静岡県浜松市中区泉4-13-22,4パチ:362台1パチ:200台21.27スロ:328台,,560,328,615
パパ浜松,静岡県浜松市中区海老塚2-13-7,1パチ:198台20スロ:360台,560,,,300
ABC浜松葵西店,静岡県浜松市中区葵西4-25-8,4パチ:320台1パチ:200台20スロ:240台5スロ:40台,,520,280,638
ＡＢＣ浜松森田町店,静岡県浜松市中区森田町字縄手西304-31,4パチ:408台1パチ:238台20スロ:406台5スロ:34台,,646,440,平面350、立駐472、計822
楽園和合店,静岡県浜松市中区和合北1-1-1,1パチ:137台2スロ:42台10スロ:79台,,137,121,250
楽園泉店,静岡県浜松市中区泉3-32-23,4パチ:44台1パチ:132台20スロ:84台5スロ:42台,,176,126,172
タイホー高丘,静岡県浜松市中区高丘西4-4-1,4パチ:192台1パチ:128台20スロ:128台,,320,128,300
OHSHO,静岡県浜松市中区領家2-7-1,0.625パチ:17台1.25パチ:102台2.5パチ:51台6.25スロ:32台1000円/50枚スロ:64台,,170,96,300
JUMBO+555高丘店,静岡県浜松市中区高丘東1-6-86,4パチ:36台1パチ:72台20スロ:239台5スロ:159台10スロ:64台,,,,266
JUMBOプラス888,静岡県浜松市中区菅原町１０番８号,4パチ:288台1パチ:200台20スロ:320台5スロ:80台,,488,400,700
ＪＵＭＢＯ＋有楽街店,静岡県浜松市中区肴町322-18ハブビル１Ｆ,[4][1]パチ[20][5]スロ,,173,160,-
グランパ葵,静岡県浜松市中区葵東2-23-38,1パチ:267台20スロ:368台,20,,,-雨や炎天下なら大型立体駐車場へ!500分完備しております!
夢屋浜松店,静岡県浜松市中区上島7-6-38,,,320,100,420
パチンコスーパー１,静岡県浜松市中区高林5-1-10,4パチ:202台20スロ:132台,,204,133,250
パチンコスーパー２,静岡県浜松市中区小豆餅1-5-1,,,200,132,180
楽園上新屋店,静岡県浜松市東区上新屋町1-5,4パチ:486台1パチ:152台,,638,543,950
ABC浜松小池町店,静岡県浜松市東区小池町1558,[4][1]パチ[5][20]スロ,,360,277,553
コンコルド浜松笠井店,静岡県浜松市東区豊町1936-1,4パチ:160台1パチ:200台20スロ:200台5スロ:80台,,360,280,560
SUPER CONCORDE市野,静岡県浜松市東区天王町1981-18,100円/93玉パチ:224台500円/116玉パチ:588台1000円/190枚スロ:91台21.277スロ:603台,1506,,,立体駐車場完備1326
ABC浜松天竜川駅前店,静岡県浜松市東区天龍川町430-1,4パチ:158台1パチ:200台20スロ:158台5スロ:40台,,360,200,412
セブンラック有玉店,静岡県浜松市東区有玉北町1718,4パチ:280台1パチ:160台20スロ:240台5スロ:40台,,480,240,720
ＪＵＭＢＯパーク大蒲店,静岡県浜松市東区大蒲町123-3,0.5パチ:36台1パチ:230台100円/25玉パチ:75台20スロ:-台1000円/180枚スロ:196台1000円/90枚スロ:200台,,344,396,761
グランパ三方原,静岡県浜松市西区大山町4163-1,1パチ:241台20スロ:281台,,,,500
スリーエー1・2,静岡県浜松市西区舞阪町長十新田300-2,4パチ:200台1パチ:280台20スロ:313台5スロ:77台,4,,,600
コンコルド浜松雄踏店,静岡県浜松市西区雄踏1-2-1,,,480,400,-
楽園西インター店,静岡県浜松市西区湖東町5697-2,4パチ:52台1パチ:122台10スロ:126台,,174,126,240
ローレル入野店,静岡県浜松市西区入野町889-1,4パチ:160台1.1パチ:120台,,280,108,300
ローレル志都呂店,静岡県浜松市西区志都呂2丁目2番10号,4パチ:200台1パチ:-台1.1パチ:160台20スロ:160台5スロ:40台,,360,200,500
マルハン若林店,静岡県浜松市南区若林町1680-5,4パチ:242台1パチ:200台20スロ:120台5スロ:80台,,440,200,540
楽園本郷店,静岡県浜松市南区本郷町90-1,1パチ:126台2パチ:42台10スロ:80台,,168,80,150
ＪＵＭＢＯ・ＣＩＴＹ大柳店,静岡県浜松市南区大柳町672-1,[4]240[1]148[0.5]64パチ[20]176[5]40スロ,,452,216,450
セブンラック若林店,静岡県浜松市南区若林町2525,4パチ:179台1パチ:120台20スロ:120台5スロ:40台,,320,160,330
スロットパークゴッド,静岡県浜松市南区中田島町622,1000円/188枚スロ:-台1000円/94枚スロ:-台21.277スロ:-台,,0,312,300
楽園三方原店,静岡県浜松市北区三方原町37,1パチ:230台20スロ:76台,,230,76,300
ジュピター三方原店,静岡県浜松市北区根洗町104,[4]パチ[1]パチ[20]スロ[2]スロ,,254,192,446
タイホー浜松三幸町,静岡県浜松市北区三幸町22,4パチ:200台1パチ:200台20スロ:160台,,400,160,601
スリーエー三方原,静岡県浜松市北区東三方町48,,,108,174,168
スーパー７,静岡県浜松市北区三方原町2432,,,200,120,300
ABC浜北店,静岡県浜松市浜北区横須賀1133-1,4パチ:240台1パチ:240台20スロ:280台5スロ:40台,,480,320,617
コンコルド浜松於呂店,静岡県浜松市浜北区於呂1015,4パチ:200台1パチ:160台20スロ:160台5スロ:40台,,360,200,783
グランパ中瀬,静岡県浜松市浜北区中瀬104-1,1パチ:209台20スロ:390台,599,,,-500
パパ新原,静岡県浜松市浜北区新原1034-1,１円パチンコ２４０台１０円スロット１００台,340,,,200
PaPaOne,静岡県浜松市浜北区中条1501-1,4パチ:237台1パチ:20台20スロ:285台,544,,,-
ポパイ,静岡県浜松市浜北区油一色383-3,,,,,-
タイホー浜北永島,静岡県浜松市浜北区永島800,,,320,160,400
ジョイランド香貫,静岡県沼津市下香貫下障子3148,4パチ:68台1.25パチ:132台20スロ:120台5スロ:42台,,200,162,200
マルハン香貫店,静岡県沼津市上香貫三貫地1161-1,4パチ:182台1パチ:144台20スロ:108台,,324,108,300
マルハン沼津店,静岡県沼津市西間門7-1,4パチ:360台1パチ:200台20スロ:240台,,560,240,680
LaRaLa NUMAZU/GROOVE,静岡県沼津市米山町1-5,,,240,207,146
スター沼津平沼店,静岡県沼津市平沼字荒須510-3,,282,,,-
ジョイランド原,静岡県沼津市原町中2-14-7,4パチ:120台1.25パチ:160台20スロ:117台5.5スロ:39台,,280,156,500
楽園沼津店,"静岡県沼津市大手町3-4-1沼津サウスビル地下1階,1階、2階",4パチ:301台1パチ:266台20スロ:353台5スロ:82台,,,,提携駐車場有り
コンコルド沼津店１・２,静岡県沼津市松長567,4パチ:280台1パチ:200台20スロ:240台5スロ:80台,800,,,788
プレイステーションタムラ香貫店,静岡県沼津市上香貫槙島町1278−1,4パチ:80台1.111パチ:120台500円90枚スロ:32台21.277スロ:80台,312,,,-
WINS,静岡県沼津市日の出町1-11,4パチ:-台1パチ:-台20スロ:-台5スロ:-台,,149,79,200
ジョイランド宝塚,静岡県沼津市大手町5-9-20,,,234,68,-
エリア01,静岡県沼津市沼北町2-17-40,,,,,-
ニュー京楽,静岡県沼津市西沢田315-2,,,,,-
東名会館,静岡県沼津市大岡2780-1,,,,,-
パチンコ芙蓉,静岡県沼津市東椎路字川向10-7,,,,,-
パチンコ戸田,静岡県沼津市戸田980-2,,,,,-
サンアシベ,静岡県熱海市銀座町8番7号,4パチ:-台1パチ:-台20スロ:-台5スロ:-台,,104,54,22
ハッピー　Ｐ－２,静岡県熱海市渚町9-1,,,0,113,60
エース,静岡県熱海市清水町1-4,,,,,-
ハッピー　Ｐ－１,静岡県熱海市渚町9-1,,,148,0,60
フジコー長伏店,静岡県三島市長伏557,パチンコ4円、1円/パチスロ20円、5円,706,,,612
フジコー三島店,静岡県三島市壱町田6-1,4パチ:208台1.1パチ:165台5.5スロ:28台21.277スロ:265台,666,,,407
ABC三島二日町店,静岡県三島市南二日町634-1,[4][1]パチ[20]スロ,,279,106,270
新甲子園,静岡県三島市東本町2-1-36,,,256,190,136
甲子園ゴールド,静岡県三島市松本252-1,4パチ:64台0.2パチ:32台1パチ:62台20スロ:112台5スロ:28台,,160,140,250
甲子園北沢店,静岡県三島市北沢64-3,,,108,64,130
ジョイランドみしま,静岡県三島市梅名308-6,,,180,120,500
プレイプラザ八億,静岡県三島市広小路町10-24,,,240,58,-
マルハン富士宮駅南店,静岡県富士宮市田中町730-3,4パチ:204台1パチ:120台20スロ:120台5スロ:40台,,320,160,360
マルハン中原店,静岡県富士宮市舞々木町113,4パチ:280台1パチ:240台20スロ:198台5スロ:40台,,520,238,700
ABC富士宮万野原店,静岡県富士宮市中原町150,4パチ:240台1パチ:120台20スロ:160台5スロ:40台,,360,200,426
ABC富士宮浅間町店,静岡県富士宮市浅間町4-18,4パチ:160台1パチ:160台20スロ:120台5スロ:40台,,320,160,376
コンコルド富士宮店,静岡県富士宮市外神東町68,4パチ:240台0.5パチ:40台1パチ:200台20スロ:240台5スロ:80台,,480,320,740
アサカン　アコージ,静岡県富士宮市城北町678,,,144,36,120
ウィズタマ学,静岡県富士宮市宮町8-34,,,,,-
SLOT DOLPHiN,静岡県伊東市玖須美元和田716-48,"２０円スロット：1,000円/47枚５円スロット：500円/90枚",,0,216,250
ABC伊東吉田店,静岡県伊東市吉田754-18,4パチ:280台1パチ:120台20スロ:160台,,400,160,432
プレイステーションタムラ伊東店,静岡県伊東市鎌田1285-12,4パチ:200台1.111パチ:200台20スロ:120台500円90枚スロ:40台,,400,160,400
ハッピーアシベ,静岡県伊東市八幡野1741-12,4パチ:192台1.111パチ:120台1000円/47枚スロ:161台,,312,161,400
フジコー伊東店,静岡県伊東市富戸971-10,4パチ:125台1パチ:149台20スロ:109台5スロ:33台,,274,142,420
ダイナム静岡伊東店　ゆったり館,静岡県伊東市荻字城の木戸585番地5,0.5パチ:40台1パチ:239台2パチ:40台5スロ:80台10スロ:80台,,320,160,480
キングアシベ,静岡県伊東市猪戸1-5-46,,,,,-
湯の花ホール,静岡県伊東市猪戸1-5-39,,,,,-
コスモアシベ,静岡県伊東市湯川1-16-11,,,,,-
パーラー湯の花,静岡県伊東市宇佐美1977-1,,,,,-
コンコルド島田六合店,静岡県島田市東町161-6,4パチ:80台1パチ:160台20スロ:159台5スロ:40台,,240,200,288
ABC島田稲荷店,静岡県島田市稲荷4-16-1,4パチ:200台1パチ:200台20スロ:160台,,400,160,596
マルハン島田店,静岡県島田市横井2-21-37,4パチ:218台1パチ:108台20スロ:144台5スロ:36台,,324,180,442
タイホー金谷,静岡県島田市金谷河原643-2,4パチ:72台1パチ:108台20スロ:92台5スロ:32台,,216,96,255
タイホー島田,静岡県島田市横井2-4799,4パチ:120台0.5パチ:40台1パチ:115台20スロ:108台5スロ:72台,,275,180,220
コンコルド島田駅前店,静岡県島田市本通1-4711-1,4パチ:160台0.5パチ:40台1パチ:160台20スロ:120台5スロ:80台,,360,200,480
エアポート777,静岡県島田市井口1483,4パチ:72台100円/175玉パチ:72台20スロ:156台2.5スロ:32台,,144,188,155
マンモス会館,静岡県富士市青葉町91,[4][1][0.5]パチ[20][4,,126,106,70
タカラ大渕店,静岡県富士市大渕3040,0.5パチ:24台1パチ:96台100円/25玉パチ:96台1000円/50枚スロ:72台,288,,,約300
ABC富士川松野店,静岡県富士市北松野1886-1,4パチ:170台1パチ:136台20スロ:102台,,306,102,279
タカラ本市場店,静岡県富士市長通104-1,,272,,,245
マルハン荒田島店,静岡県富士市荒田島町10-37,4パチ:204台1パチ:201台20スロ:120台5スロ:40台,,400,160,456
マルハン吉原店,静岡県富士市八代町12-12,,,400,240,500
マルハン鷹岡店,静岡県富士市久沢字柳田1-1,4パチ:150台1パチ:156台20スロ:136台5スロ:40台,,304,176,461
ＦＵＪＩＭＩインター店,静岡県富士市伝法字東平2448,4パチ:150台1パチ:100台20スロ:141台5スロ:47台10スロ:48台,,250,204,297
スリーエー富士,静岡県富士市久沢1692-39,4パチ:80台1パチ:80台20スロ:118台10スロ:80台,,,,300
ABC富士荒田島店,静岡県富士市荒田島257-1,4パチ:240台1パチ:160台20スロ:120台5スロ:40台,,400,160,451
ABC富士弥生通り店,静岡県富士市伝法1280,4パチ:280台1パチ:160台20スロ:200台,,440,200,506
パーラージュピター厚原店,静岡県富士市厚原1622-1,4パチ:90台1パチ:161台20スロ:157台,,,,約300
ＦＵＪＩＭＩ吉原南店,静岡県富士市南町6-15,4パチ:48台0.5パチ:20台200円/150玉パチ:144台20スロ:50台5スロ:63台,,212,113,148
ＡＢＣ富士今泉店,静岡県富士市今泉3-15-30,[4][1]パチ[5][20]スロ,,540,284,621
アプリイ富士川,静岡県富士市南松野23-1 ,4パチ:180台1パチ:144台20スロ:162台5スロ:18台,,324,180,456
ＦＵＪＩＭＩ鷹岡店,静岡県富士市久沢113-2,[4][1]パチ[20][5]スロ,,254,185,400
コンコルド富士店,静岡県富士市厚原278,100円/93玉パチ:200台1000円/240玉パチ:360台1000円/190枚スロ:40台1000円/93枚スロ:40台21.277スロ:400台,1040,,,965
タカラ水戸島店,静岡県富士市水戸島1丁目1番23号,1パチ:99台100円/25玉パチ:218台2スロ:14台1000円/200枚スロ:16台1000円/50枚スロ:145台,500,,,約500
タカラ柳島店,静岡県富士市川成島52-2,1パチ:74台100円/25玉パチ:136台1000円/200枚スロ:38台1000円/50枚スロ:128台,424,,,約430
タカラ原田店,静岡県富士市原田1665−2,0.5パチ:20台1パチ:120台100円/25玉パチ:80台1000円/200枚スロ:37台1000円/50枚スロ:40台,300,,,約300
ニューマカオ,静岡県富士市富士岡466,,,,,-
パーラーニューヨーク富士店,静岡県富士市日乃出町40,,,,,-
オーギヤ磐田店,静岡県磐田市上万能262-1,4パチ:414台1パチ:240台20スロ:361台5スロ:40台,,654,401,800
ABC磐田今之浦店,静岡県磐田市鳥之瀬200,4パチ:160台1パチ:64台20スロ:96台,,224,96,307
ゴールドモンキー豊田店,静岡県磐田市豊田西之島218-3,1000円/376枚スロ:32台1000円/188枚スロ:48台1000円/94枚スロ:32台1000円/47枚スロ:80台,,0,176,250
ABC磐田中泉店,静岡県磐田市中泉851,4パチ:280台1パチ:240台20スロ:240台5スロ:40台,,520,280,641
JUMBOプラス333磐田店,静岡県磐田市一言1684-1,[1]パチ[4]パチ[20]スロ[5]スロ,,144,187,300
タイキ1333磐田南店,静岡県磐田市上岡田116-1,,1333,,,大型立体駐車場完備
スーパーモンキー今之浦店,静岡県磐田市今之浦2-13-2,0.5パチ:71台1パチ:54台2パチ:36台3スロ:32台10スロ:80台,,161,112,280
スリーエー竜洋,静岡県磐田市岡1018,100円/90玉パチ:80台100円/25玉パチ:80台1000円/200枚スロ:40台1000円/50枚スロ:111台,,160,151,186
竜光磐田店,静岡県磐田市西貝塚459,,,,,-
コンコルド東名店,静岡県焼津市八楠1-1-1,4パチ:118台0.5パチ:40台1パチ:80台20スロ:114台5スロ:57台,,240,171,370
マルハン焼津店,静岡県焼津市中新田字道灌島912,4パチ:202台1パチ:120台20スロ:120台5スロ:40台,,320,160,382
ABC焼津三ケ名店,静岡県焼津市三ヶ名180,4パチ:280台1パチ:160台20スロ:160台5スロ:40台,,440,200,518
コンコルド大住店,静岡県焼津市大住671-1,4パチ:120台1パチ:160台20スロ:120台5スロ:80台,,280,200,450
ダイス大島店,静岡県焼津市大島727,4パチ:128台1.111パチ:127台20スロ:90台2.5スロ:48台,394,,,265
ＦＵＪＩＭＩ西焼津店,静岡県焼津市柳新屋335,4パチ:40台1パチ:149台20スロ:89台10スロ:48台,,188,144,250
コンコルド焼津惣右衛門店,静岡県焼津市惣右衛門352-1,4パチ:80台0.5パチ:40台1パチ:200台20スロ:80台5スロ:80台10スロ:40台,,320,200,400
ABC焼津三和店,静岡県焼津市三和1820,4パチ:200台1パチ:160台20スロ:160台5スロ:40台,,360,200,481
パチンコプラザ150号店,静岡県焼津市石津800,4円パチンコ196台1円パチンコ112台20円スロット136台,,308,136,251
アチャラナータ,静岡県焼津市八楠1-1-4,4パチ:73台0.5パチ:36台1パチ:108台20スロ:107台5スロ:33台,,216,139,250
パチンコプラザ駅前店,静岡県焼津市栄町1-7-3,,,179,54,80
